{
  "taskId": "FF-VSL-002",
  "stage": "S3",
  "goal": "Implement reliable analysis dispatch, Python worker invocation, deterministic pipeline and idempotent result ingestion (outbox / worker ports, duplicate delivery idempotent, retry-timeout-cancel-analysis-error modeled).",
  "nonGoals": [
    "RabbitMQ broker deployment",
    "cluster ranking (S6)"
  ],
  "readSet": [
    "docs/contracts/worker-command.schema.json",
    "docs/contracts/worker-result.schema.json"
  ],
  "writeSet": [
    "frameflow-modules/product/src/main/java/com/frameflow/product/infrastructure/worker/WorkerRunner.java",
    "frameflow-modules/product/src/main/java/com/frameflow/product/infrastructure/worker/LocalWorkerDispatcher.java",
    "frameflow-modules/product/src/main/java/com/frameflow/product/application/AnalysisService.java",
    ".frameflow/tasks/FF-VSL-002.json"
  ],
  "allowedCommands": [
    "./mvnw -B compile"
  ],
  "networkPolicy": "OFF",
  "acceptance": [
    {
      "id": "A1",
      "criterion": "Postgres is final business state source"
    },
    {
      "id": "A2",
      "criterion": "worker never writes Java business tables"
    },
    {
      "id": "A3",
      "criterion": "duplicate command/result delivery idempotent"
    },
    {
      "id": "A4",
      "criterion": "retry timeout cancel dead-letter and analysis error modeled"
    },
    {
      "id": "A5",
      "criterion": "media facts findings evidence artifacts return"
    },
    {
      "id": "A6",
      "criterion": "worker contract tests pass"
    }
  ],
  "tests": [
    {
      "id": "T1",
      "command": "product compile"
    },
    {
      "id": "T2",
      "command": "ProductFlowIntegrationTest"
    }
  ],
  "evidence": [
    {
      "acceptanceId": "A1",
      "path": "frameflow-app/src/main/resources/db/migration/V7__analysis_and_outbox.sql"
    },
    {
      "acceptanceId": "A3",
      "path": "frameflow-modules/product/src/main/java/com/frameflow/product/application/AnalysisService.java"
    },
    {
      "acceptanceId": "A5",
      "path": "frameflow-ai-worker/src/frameflow_ai/pipeline.py"
    }
  ],
  "rollback": "worker ports additive; unconfigured worker keeps pipeline testable",
  "fallback": "database job queue and local worker CLI behind same ports when RabbitMQ unavailable",
  "attempt": 1,
  "status": "ACCEPTED"
}
