{
  "taskId": "FF-DOM-001",
  "stage": "S2",
  "goal": "Finalize OpenAPI domain contracts, state machines, permissions and error catalog for the complete FrameFlow Select workflow; keep identity contract preserved/versioned.",
  "nonGoals": [
    "Implement media infrastructure",
    "Java worker dispatch"
  ],
  "readSet": [
    "docs/contracts/**",
    "docs/04-api/**",
    "docs/core/BOOK-04"
  ],
  "writeSet": [
    "docs/04-api/openapi/frameflow-v1.yaml",
    ".frameflow/tasks/FF-DOM-001.json",
    "evidence/frameflow-select/s2/**"
  ],
  "allowedCommands": [
    "./mvnw -B test",
    "git add/commit"
  ],
  "networkPolicy": "OFF",
  "acceptance": [
    {
      "id": "A1",
      "criterion": "identity contract preserved or versioned"
    },
    {
      "id": "A2",
      "criterion": "project profile batch candidate analysis review ranking selection APIs defined"
    },
    {
      "id": "A3",
      "criterion": "idempotency tenant authorization and 404 policy explicit"
    },
    {
      "id": "A4",
      "criterion": "async and error contracts complete"
    },
    {
      "id": "A5",
      "criterion": "schemas validate"
    }
  ],
  "tests": [
    {
      "id": "T1",
      "command": "OpenApiDiffTest"
    },
    {
      "id": "T2",
      "command": "python json schema validation"
    }
  ],
  "evidence": [
    {
      "acceptanceId": "A1",
      "path": "docs/04-api/openapi/frameflow-v1.yaml"
    },
    {
      "acceptanceId": "A2",
      "path": "docs/04-api/openapi/frameflow-v1.yaml"
    },
    {
      "acceptanceId": "A5",
      "path": "evidence/frameflow-select/s2/schema-validation.txt"
    }
  ],
  "rollback": "contract YAML version-controlled; regenerated from runtime",
  "fallback": "split OpenAPI into referenced files keeping one authoritative root",
  "attempt": 1,
  "status": "ACCEPTED"
}
