{
  "taskId": "FF-DOM-002",
  "stage": "S2",
  "goal": "Implement the complete Java modular-monolith domain foundation (project/profile/batch/candidate/analysis/review/ranking/selection) with forward-only migrations, immutability, tenant authorization and integration tests.",
  "nonGoals": [
    "Object storage integration",
    "RabbitMQ worker"
  ],
  "readSet": [
    "docs/core/BOOK-04",
    "docs/contracts/**"
  ],
  "writeSet": [
    "frameflow-modules/product/**",
    "frameflow-app/src/main/resources/db/migration/V5__project_and_quality.sql",
    "V6__batch_and_candidate.sql",
    "V7__analysis_and_outbox.sql",
    "V8__review_ranking_selection.sql",
    "frameflow-app/pom.xml",
    "frameflow-modules/pom.xml",
    "frameflow-app/src/test/java/com/frameflow/product/**",
    ".frameflow/tasks/FF-DOM-002.json",
    "evidence/frameflow-select/s2/**"
  ],
  "allowedCommands": [
    "./mvnw -B test",
    "git add/commit"
  ],
  "networkPolicy": "OFF",
  "acceptance": [
    {
      "id": "A1",
      "criterion": "published quality profile versions immutable"
    },
    {
      "id": "A2",
      "criterion": "batch references prompt and profile snapshots"
    },
    {
      "id": "A3",
      "criterion": "candidate versions and analysis runs immutable"
    },
    {
      "id": "A4",
      "criterion": "machine results and human overrides separate"
    },
    {
      "id": "A5",
      "criterion": "ranking and selection snapshots versioned"
    },
    {
      "id": "A6",
      "criterion": "tenant and permission negative tests pass"
    },
    {
      "id": "A7",
      "criterion": "runtime openapi matches contract"
    }
  ],
  "tests": [
    {
      "id": "T1",
      "command": "./mvnw -B -pl frameflow-app -am test -Dtest=ProductFlowIntegrationTest"
    },
    {
      "id": "T2",
      "command": "OpenApiDiffTest"
    },
    {
      "id": "T3",
      "command": "fresh DB migration passes (V1-V8)"
    }
  ],
  "evidence": [
    {
      "acceptanceId": "A1",
      "path": "frameflow-modules/product/src/main/java/com/frameflow/product/application/ProjectService.java"
    },
    {
      "acceptanceId": "A6",
      "path": "frameflow-app/src/test/java/com/frameflow/product/ProductFlowIntegrationTest.java"
    },
    {
      "acceptanceId": "A7",
      "path": "evidence/frameflow-select/s2/openapi-diff.txt"
    },
    {
      "acceptanceId": "A3",
      "path": "frameflow-app/src/main/resources/db/migration/V6__batch_and_candidate.sql"
    }
  ],
  "rollback": "domain module + migrations new; V1-V4 untouched; fresh DB rebuild",
  "fallback": "store versioned profile payloads as validated JSONB (done) while keeping typed service boundaries",
  "attempt": 1,
  "status": "ACCEPTED"
}
