{
  "taskId": "FF-BAT-001",
  "stage": "S4",
  "goal": "Implement batch ingestion, processing, progress and reconciliation with rerun: bounded capacity (batch_id,candidate_key unique; 300 default cap), worker-optional partial-failure accounting, progress API that reconciles to total, and rerun creating a fresh analysis run.",
  "nonGoals": [
    "deterministic eligibility gate / quality vector (FF-BAT-002)",
    "clustering/ranking (S6)"
  ],
  "readSet": [
    "docs/04-api/openapi/frameflow-v1.yaml",
    "frameflow-modules/product/src/main/java/com/frameflow/product/application/AnalysisService.java"
  ],
  "writeSet": [
    "frameflow-modules/product/src/main/java/com/frameflow/product/application/BatchOrchestrator.java",
    "frameflow-modules/product/src/main/java/com/frameflow/product/web/BatchEngineController.java",
    "frameflow-modules/product/src/main/java/com/frameflow/product/infrastructure/persistence/AnalysisRepositories.java",
    "frameflow-app/src/test/java/com/frameflow/product/BatchEngineIntegrationTest.java",
    ".frameflow/tasks/FF-BAT-001.json",
    "evidence/frameflow-select/s4/batch-engine.txt"
  ],
  "allowedCommands": [
    "./mvnw -B -pl frameflow-app -am test -Dtest=BatchEngineIntegrationTest,ProductFlowIntegrationTest -Dsurefire.failIfNoSpecifiedTests=false"
  ],
  "networkPolicy": "OFF",
  "acceptance": [
    {
      "id": "A1",
      "criterion": "distinct candidate_keys in one batch are allowed and progress reconciles to total"
    },
    {
      "id": "A2",
      "criterion": "capacity bound (default 300) is enforced above the limit"
    },
    {
      "id": "A3",
      "criterion": "partial upload/analysis failure is visible (ANALYSIS_ERROR) and recoverable"
    },
    {
      "id": "A4",
      "criterion": "rerun creates a new analysis run with a fresh run id"
    },
    {
      "id": "A5",
      "criterion": "ingestion and result delivery are idempotent"
    }
  ],
  "tests": [
    {
      "id": "T1",
      "command": "BatchEngineIntegrationTest (2 tests)"
    },
    {
      "id": "T2",
      "command": "ProductFlowIntegrationTest (2 tests)"
    }
  ],
  "evidence": [
    {
      "acceptanceId": "A1",
      "path": "frameflow-app/src/test/java/com/frameflow/product/BatchEngineIntegrationTest.java"
    },
    {
      "acceptanceId": "A4",
      "path": "frameflow-modules/product/src/main/java/com/frameflow/product/application/BatchOrchestrator.java"
    },
    {
      "acceptanceId": "A3",
      "path": "evidence/frameflow-select/s4/batch-engine.txt"
    }
  ],
  "rollback": "batch engine additive; no migration or existing endpoint changed",
  "fallback": "sequential processing with explicit capacity limits behind the same API",
  "attempt": 1,
  "status": "ACCEPTED"
}
