{
  "taskId": "FF-PIV-003",
  "stage": "S0",
  "goal": "Harden repository hygiene, migrate team roles to OWNER/OPERATOR/REVIEWER/VIEWER (forward-only V4), and pin the reproducible toolchain without any unnecessary framework upgrade.",
  "nonGoals": [
    "Implement product business features",
    "Start media infrastructure",
    "Modify V1-V3 Flyway migrations"
  ],
  "readSet": [
    "frameflow-modules/identity/**",
    "frameflow-app/src/main/resources/db/migration/V*.sql",
    "frameflow-app/src/test/java/com/frameflow/identity/**",
    "docs/contracts/ROLE-PERMISSION-MATRIX.md",
    "docs/04-api/openapi/frameflow-v1.yaml"
  ],
  "writeSet": [
    "frameflow-app/src/main/resources/db/migration/V4__team_role_model.sql",
    "frameflow-modules/identity/src/main/java/com/frameflow/identity/web/dto/TeamRole.java",
    "frameflow-modules/identity/src/main/java/com/frameflow/identity/domain/TeamMember.java",
    "frameflow-app/src/test/java/com/frameflow/identity/**",
    "scripts/m01/auth-flows.sh",
    "docs/04-api/**",
    "docs/03-data/identity-data-dictionary.md",
    ".frameflow/toolchain.json"
  ],
  "allowedCommands": [
    "./mvnw -B clean verify",
    "./mvnw -B test",
    "git add/commit",
    "git worktree add"
  ],
  "networkPolicy": "OFF",
  "acceptance": [
    {
      "id": "A1",
      "criterion": "old flyway files V1-V3 unchanged"
    },
    {
      "id": "A2",
      "criterion": "roles are OWNER/OPERATOR/REVIEWER/VIEWER with compatibility mapping"
    },
    {
      "id": "A3",
      "criterion": "owner invariant and negative authorization tests pass"
    },
    {
      "id": "A4",
      "criterion": "no tracked private keys or build junk"
    },
    {
      "id": "A5",
      "criterion": "existing identity and contract tests (incl OpenApiDiff) pass"
    },
    {
      "id": "A6",
      "criterion": "no unnecessary framework major upgrade"
    },
    {
      "id": "A7",
      "criterion": "toolchain pinned (machine-readable)"
    }
  ],
  "tests": [
    {
      "id": "T1",
      "command": "git diff --name-only HEAD -- frameflow-app/src/main/resources/db/migration/V1__baseline.sql V2__identity.sql V3__table_and_column_comments.sql"
    },
    {
      "id": "T2",
      "command": "./mvnw -B -pl frameflow-app -am test -Dtest=OwnerInvariantsTest,PermissionTest,CrossTeamAccessTest,V2SchemaBoundaryTest,OpenApiDiffTest"
    },
    {
      "id": "T3",
      "command": "git ls-files | grep -E '(^|/)(\\.env$|.*\\.pem$|.*target/.*|.*\\.DS_Store$|.*\\.zcode/.*)' "
    },
    {
      "id": "T4",
      "command": "python3 -c 'import json; json.load(open(\".frameflow/toolchain.json\"))'"
    }
  ],
  "evidence": [
    {
      "acceptanceId": "A1",
      "path": ".frameflow/tasks/FF-PIV-003.json"
    },
    {
      "acceptanceId": "A2",
      "path": "docs/contracts/ROLE-PERMISSION-MATRIX.md"
    },
    {
      "acceptanceId": "A3",
      "path": "evidence/frameflow-select/s0/piv003-owner-invariants.txt"
    },
    {
      "acceptanceId": "A4",
      "path": "evidence/frameflow-select/s0/piv003-hygiene.txt"
    },
    {
      "acceptanceId": "A5",
      "path": "evidence/frameflow-select/s0/piv003-tests.txt"
    },
    {
      "acceptanceId": "A6",
      "path": ".frameflow/toolchain.json"
    },
    {
      "acceptanceId": "A7",
      "path": ".frameflow/toolchain.json"
    }
  ],
  "rollback": "git revert of V4 + TeamRole edits; legacy data remap is forward-only but a fresh DB rebuild restores original values (no destructive op).",
  "fallback": "keep current compatible Java/Spring versions and use a role alias compatibility layer if a strict enum breaks the contract.",
  "attempt": 1,
  "status": "VERIFYING"
}
