{
  "taskId": "FF-PIV-001",
  "stage": "S0",
  "goal": "Preserve the real legacy baseline (HEAD bb97351, branch chore/ff-piv-001-close-m01h) and resolve the dirty M01-H evidence anomaly before any pivot cleanup.",
  "nonGoals": [
    "Implement any FrameFlow Select business feature",
    "Run the legacy docs migration (that is FF-PIV-002)",
    "Install new product facts (that is FF-PIV-002)"
  ],
  "readSet": ["evidence/m01h/*.txt", "scripts/m01h/*", "frameflow-app/src/main/resources/db/migration/V*.sql", "docs/", "pom.xml", ".git"],
  "writeSet": ["evidence/pivot/autopilot-start/", "evidence/pivot/legacy-snapshot/", ".frameflow/tasks/FF-PIV-001.json", "evidence/pivot/ff-piv-001/"],
  "allowedCommands": ["git status", "git diff", "git log", "git rev-parse", "git ls-files", "git commit", "git tag", "git switch -c", "bash echo/cp/mkdir", "./mvnw -B clean verify"],
  "networkPolicy": "OFF",
  "acceptance": [
    {"id":"A1","criterion":"handoff payload (AGENTS.md/.agents/FRAMEFLOW_SELECT_AUTOPILOT) distinguished from pre-existing dirty work"},
    {"id":"A2","criterion":"all pre-existing changes (5 m01h evidence files) preserved before cleanup"},
    {"id":"A3","criterion":"m01h evidence anomaly explained or marked unknown (classification recorded)"},
    {"id":"A4","criterion":"no source change silently discarded"},
    {"id":"A5","criterion":"task capsule conforms to task.schema.json"}
  ],
  "tests": [
    {"id":"T1","command":"python3 -c 'import json,pathlib; json.loads(pathlib.Path(\".frameflow/tasks/FF-PIV-001.json\").read_text())'"},
    {"id":"T2","command":"ls evidence/pivot/legacy-snapshot/current-worktree/evidence/m01h/ && ls evidence/pivot/legacy-snapshot/head-version/evidence/m01h/"},
    {"id":"T3","command":"python3 FRAMEFLOW_SELECT_AUTOPILOT/tools/verify_pack.py"}
  ],
  "evidence": [
    {"acceptanceId":"A1","path":"evidence/pivot/autopilot-start/baseline.json"},
    {"acceptanceId":"A2","path":"evidence/pivot/legacy-snapshot/current-worktree/"},
    {"acceptanceId":"A3","path":"evidence/pivot/ff-piv-001/m01h-classification.json"},
    {"acceptanceId":"A4","path":"evidence/pivot/autopilot-start/working-tree-baseline.patch"},
    {"acceptanceId":"A5","path":".frameflow/tasks/FF-PIV-001.json"}
  ],
  "rollback": "Baseline and dirty diff saved under evidence/pivot/; legacy tag created only after commit; HEAD/branch recorded in baseline.json.",
  "fallback": "Preserve binary patch and continue from recorded head without claiming a clean baseline.",
  "attempt": 1,
  "status": "VERIFYING"
}
