{
  "taskId": "FF-BAT-002",
  "stage": "S4",
  "goal": "Lock the S4 batch engine contract in the OpenAPI authority and record versioned batch summary/quality-gate state: regenerate docs/04-api/openapi/frameflow-v1.yaml from the runtime springdoc dump to expose process/progress/rerun, and keep the deterministic quality gate deterministic with evidence.",
  "nonGoals": [
    "semantic/AI QA (S5)",
    "clustering/ranking (S6)"
  ],
  "readSet": [
    "/tmp/ff/runtime-openapi4.json",
    "frameflow-app/src/test/java/com/frameflow/identity/OpenApiDumpTool.java"
  ],
  "writeSet": [
    "docs/04-api/openapi/frameflow-v1.yaml",
    ".frameflow/tasks/FF-BAT-002.json",
    "evidence/frameflow-select/s4/batch-engine.txt"
  ],
  "allowedCommands": [
    "./mvnw -B -pl frameflow-app -am test -Dtest=OpenApiDumpTool -Dframeflow.openapi.dump=/tmp/ff/runtime-openapi4.json -Dsurefire.failIfNoSpecifiedTests=false",
    "./mvnw -B -pl frameflow-app -am test -Dtest=OpenApiDiffTest -Dsurefire.failIfNoSpecifiedTests=false"
  ],
  "networkPolicy": "OFF",
  "acceptance": [
    {
      "id": "A1",
      "criterion": "runtime OpenAPI matches the handwritten authoritative contract after normalization"
    },
    {
      "id": "A2",
      "criterion": "batch process/progress/rerun endpoints are present in the contract"
    },
    {
      "id": "A3",
      "criterion": "no infra /health,/readiness,/probe paths in the contract"
    },
    {
      "id": "A4",
      "criterion": "quality gate stays deterministic; unknown never auto-rejects"
    }
  ],
  "tests": [
    {
      "id": "T1",
      "command": "OpenApiDiffTest (1 test)"
    }
  ],
  "evidence": [
    {
      "acceptanceId": "A1",
      "path": "docs/04-api/openapi/frameflow-v1.yaml"
    },
    {
      "acceptanceId": "A3",
      "path": "evidence/frameflow-select/s4/batch-engine.txt"
    }
  ],
  "rollback": "contract regen only touches shared OpenAPI YAML; no migration changed",
  "fallback": "keep handwritten contract but regenerate from dump when new endpoints land",
  "attempt": 1,
  "status": "ACCEPTED"
}
