{
  "taskId": "FF-SEL-003",
  "stage": "S6",
  "goal": "Selection engine verified: same inputs+versions produce same ranking; duplicate cluster and Top-K fixture cases pass; human override and lock_version tested.",
  "nonGoals": [
    "advanced embeddings"
  ],
  "readSet": [
    "docs/core/BOOK-03"
  ],
  "writeSet": [
    ".frameflow/tasks/FF-SEL-003.json",
    "evidence/frameflow-select/s6/**"
  ],
  "allowedCommands": [
    "./mvnw -B test"
  ],
  "networkPolicy": "OFF",
  "acceptance": [
    {
      "id": "A1",
      "criterion": "same inputs and versions produce same ranking"
    },
    {
      "id": "A2",
      "criterion": "duplicate cluster and Top-K fixture cases pass"
    },
    {
      "id": "A3",
      "criterion": "human override and lock version tests pass"
    }
  ],
  "tests": [
    {
      "id": "T1",
      "command": "ProductFlowIntegrationTest (ranking/selection/lock)"
    }
  ],
  "evidence": [
    {
      "acceptanceId": "A1",
      "path": "frameflow-modules/product/src/main/java/com/frameflow/product/application/SelectionService.java"
    },
    {
      "acceptanceId": "A2",
      "path": "frameflow-app/src/test/java/com/frameflow/product/ProductFlowIntegrationTest.java"
    }
  ],
  "rollback": "ranking additive",
  "fallback": "disable near-duplicate merge and retain exact duplicates plus manual selection",
  "attempt": 1,
  "status": "ACCEPTED"
}
