{
  "taskId": "FF-FEA-001",
  "stage": "S1",
  "goal": "Build a reproducible synthetic fixture dataset and a deterministic media QA toolkit (probe + detectors) with tested technical findings.",
  "nonGoals": [
    "Build Java business modules",
    "Integrate with object storage or queues"
  ],
  "readSet": [
    "docs/core/BOOK-03",
    "docs/contracts/*.json",
    "experiments/fixtures/*.json"
  ],
  "writeSet": [
    "frameflow-ai-worker/src/frameflow_ai/**",
    "frameflow-ai-worker/tests/**",
    "experiments/fixtures/*.json",
    ".gitignore",
    "evidence/frameflow-select/s1/**",
    ".frameflow/tasks/FF-FEA-001.json"
  ],
  "allowedCommands": [
    "frameflow-ai-worker/.venv/bin/python",
    "git add/commit",
    "bash"
  ],
  "networkPolicy": "OFFICIAL_DEPENDENCIES_ONLY",
  "acceptance": [
    {
      "id": "A1",
      "criterion": "fixtures cover normal wrong_aspect short silent black freeze exact_duplicate and low_resolution"
    },
    {
      "id": "A2",
      "criterion": "ffprobe facts are machine readable"
    },
    {
      "id": "A3",
      "criterion": "black freeze duration aspect resolution and audio checks are tested"
    },
    {
      "id": "A4",
      "criterion": "fixtures are reproducible and copyright safe (lavfi only)"
    }
  ],
  "tests": [
    {
      "id": "T1",
      "command": "frameflow-ai-worker/.venv/bin/python -m pytest"
    },
    {
      "id": "T2",
      "command": "fixture generator runs and writes dataset-manifest.json"
    },
    {
      "id": "T3",
      "command": "media probe returns JSON facts"
    }
  ],
  "evidence": [
    {
      "acceptanceId": "A1",
      "path": "experiments/fixtures/generated/dataset-manifest.json"
    },
    {
      "acceptanceId": "A2",
      "path": "evidence/frameflow-select/s1/s1-tests.txt"
    },
    {
      "acceptanceId": "A3",
      "path": "frameflow-ai-worker/tests/test_detectors.py"
    },
    {
      "acceptanceId": "A4",
      "path": "frameflow-ai-worker/src/frameflow_ai/fixtures.py"
    }
  ],
  "rollback": "synthetic fixtures are generated artifacts, not authoritative; worker modules segregated under frameflow-ai-worker.",
  "fallback": "metadata-only fixtures and capability detection if ffmpeg is unavailable.",
  "attempt": 1,
  "status": "ACCEPTED"
}
